{
  "$id": "specwright.verification.eval-verdict-contract",
  "$schema": "https://json-schema.org/draft/2020-12/schema",
  "additionalProperties": false,
  "properties": {
    "evalId": {
      "type": "string"
    },
    "evidenceRefs": {
      "items": {
        "type": "string"
      },
      "type": "array"
    },
    "findings": {
      "items": {
        "additionalProperties": false,
        "properties": {
          "code": {
            "type": "string"
          },
          "evidenceRefs": {
            "items": {
              "type": "string"
            },
            "type": "array"
          },
          "id": {
            "type": "string"
          },
          "message": {
            "type": "string"
          },
          "metadata": {
            "additionalProperties": {},
            "type": "object"
          },
          "path": {
            "type": "string"
          },
          "repairHint": {
            "type": "string"
          },
          "severity": {
            "enum": [
              "advisory",
              "blocking"
            ]
          },
          "targetRef": {
            "type": "string"
          }
        },
        "required": [
          "message"
        ],
        "type": "object"
      },
      "type": "array"
    },
    "producedBy": {
      "additionalProperties": false,
      "properties": {
        "kind": {
          "enum": [
            "deterministic",
            "model_assisted",
            "human"
          ]
        },
        "ref": {
          "type": "string"
        }
      },
      "required": [
        "kind",
        "ref"
      ],
      "type": "object"
    },
    "provenance": {
      "additionalProperties": false,
      "properties": {
        "causationIds": {
          "items": {
            "type": "string"
          },
          "type": "array"
        },
        "decisionHash": {
          "type": "string"
        },
        "evaluatedAt": {
          "format": "date-time",
          "type": "string"
        },
        "phase": {
          "type": "string"
        },
        "runId": {
          "type": "string"
        },
        "traceId": {
          "type": "string"
        }
      },
      "required": [],
      "type": "object"
    },
    "repairTask": {
      "additionalProperties": false,
      "properties": {
        "acceptanceChecks": {
          "items": {
            "type": "string"
          },
          "type": "array"
        },
        "allowedRefs": {
          "items": {
            "type": "string"
          },
          "type": "array"
        },
        "allowedTools": {
          "items": {
            "type": "string"
          },
          "type": "array"
        },
        "blockedTools": {
          "items": {
            "type": "string"
          },
          "type": "array"
        },
        "constraints": {
          "additionalProperties": {},
          "type": "object"
        },
        "createdFromFindingIds": {
          "items": {
            "type": "string"
          },
          "type": "array"
        },
        "escalationRule": {
          "type": "string"
        },
        "expiresAt": {
          "format": "date-time",
          "type": "string"
        },
        "failedPhase": {
          "type": "string"
        },
        "gateId": {
          "type": "string"
        },
        "id": {
          "type": "string"
        },
        "metadata": {
          "additionalProperties": {},
          "type": "object"
        },
        "problem": {
          "type": "string"
        },
        "producedBy": {
          "additionalProperties": false,
          "properties": {
            "kind": {
              "enum": [
                "deterministic",
                "model_assisted",
                "human"
              ]
            },
            "ref": {
              "type": "string"
            }
          },
          "required": [
            "kind",
            "ref"
          ],
          "type": "object"
        },
        "repairId": {
          "type": "string"
        },
        "requiredCorrection": {
          "type": "string"
        },
        "requiredEvidenceRefs": {
          "items": {
            "type": "string"
          },
          "type": "array"
        },
        "sourceFindingId": {
          "type": "string"
        },
        "successEval": {
          "type": "string"
        },
        "successGate": {
          "type": "string"
        },
        "targetRef": {
          "type": "string"
        },
        "task": {
          "type": "string"
        }
      },
      "required": [],
      "type": "object",
      "x-zod-effect": "refinement"
    },
    "severity": {
      "enum": [
        "advisory",
        "blocking"
      ]
    },
    "status": {
      "enum": [
        "pass",
        "fail",
        "needs_review",
        "skipped",
        "repaired"
      ]
    },
    "targetRef": {
      "type": "string"
    }
  },
  "required": [
    "evalId",
    "evidenceRefs",
    "findings",
    "producedBy",
    "severity",
    "status",
    "targetRef"
  ],
  "title": "EvalVerdictContractSchema",
  "type": "object",
  "x-specwright-contract": {
    "family": "verification",
    "hash": "sha256:aded7a517f2bc1caff35cd7049f1609ae4aea1ecef84bf78c1fd940bcb06a04c",
    "id": "specwright.verification.eval-verdict-contract",
    "status": "public",
    "version": "1"
  }
}
