{
  "evalId": "semantic_rubric",
  "targetRef": "artifact:summary",
  "status": "needs_review",
  "severity": "advisory",
  "findings": [
    {
      "code": "eval.type.unsupported",
      "message": "Eval type model_assisted requires capabilities outside the deterministic EvalRunner slice",
      "severity": "advisory",
      "targetRef": "artifact:summary",
      "repairHint": "Route this eval through an explicit ToolBroker-backed or human review path."
    }
  ],
  "evidenceRefs": [],
  "producedBy": {
    "kind": "deterministic",
    "ref": "specwright.eval-runner.v1"
  },
  "provenance": {
    "decisionHash": "sha256:b75029292f3b7fef81fab79fe46da6d369cd837cf958c12da32c5d4a302c34e1",
    "causationIds": [
      "specwright.eval-runner.input-hash.targetContentHash=sha256:f58202ef75bcdbe1ec4ce2adba09ca2a92be19f587618106df662475d6bdb068",
      "specwright.eval-runner.input-hash.evidenceSnapshotHash=sha256:ba4a85a126eb516ad252a71d23e919c78411d0876739fedd5a7a47caa602e634",
      "specwright.eval-runner.input-hash.definitionHash=sha256:cb17bd1cdb33e75e3fb4b2e05cb01b8183a48c3b5b929cc17ac80585206d41e5",
      "specwright.eval-runner.input-hash.checkResultsHash=sha256:4f53cda18c2baa0c0354bb5f9a3ecbe5ed12ab4d8e11ba873c2f11161202b945"
    ]
  }
}
