{
  "evalId": "artifact_schema_presence",
  "targetRef": "artifact:plan",
  "status": "pass",
  "severity": "blocking",
  "findings": [],
  "evidenceRefs": [],
  "producedBy": {
    "kind": "deterministic",
    "ref": "specwright.eval-runner.v0"
  },
  "provenance": {
    "decisionHash": "sha256:1687c0cf4ca3d79160fae590b1173abdef22cf09cac6038cc72b24f6fc04977e",
    "causationIds": [
      "specwright.eval-runner.input-hash.targetContentHash=sha256:45a64cf16ed14ee8e8af879e5864f743ddc2d855fe4b34f9500b3502997b44c5",
      "specwright.eval-runner.input-hash.evidenceSnapshotHash=sha256:69e4bbb72ed4ae44b80f05b270cf7f8fe0e4fbc259d7e6cfc168181dc45fe037",
      "specwright.eval-runner.input-hash.definitionHash=sha256:9130a3b67a1c34c2c0d02bc036ed42d3abbb7f2cb3430986c32b8d0931657cc8",
      "specwright.eval-runner.input-hash.checkResultsHash=sha256:cdb802f4542009b70238eeb6d2801f0a2416e89f11fef043ba4924750765334c"
    ]
  }
}
