{
  "evalId": "definition_missing",
  "targetRef": "eval:definition_missing",
  "status": "fail",
  "severity": "blocking",
  "findings": [
    {
      "code": "eval.definition.missing",
      "message": "Eval definition definition_missing is missing",
      "severity": "blocking",
      "targetRef": "eval:definition_missing",
      "repairHint": "Provide a declared eval definition before running it."
    }
  ],
  "evidenceRefs": [],
  "producedBy": {
    "kind": "deterministic",
    "ref": "specwright.eval-runner.v1"
  },
  "provenance": {
    "decisionHash": "sha256:b931f2c712a34cfbc2c67f544086a5b8f29c341f07645ce42341ff1a3b7017f9",
    "causationIds": [
      "specwright.eval-runner.input-hash.targetContentHash=sha256:995b2fe6c999b410784aa6cb8d76ecd0a469e66f4aea4d592f827208b4505e05",
      "specwright.eval-runner.input-hash.evidenceSnapshotHash=sha256:ba4a85a126eb516ad252a71d23e919c78411d0876739fedd5a7a47caa602e634",
      "specwright.eval-runner.input-hash.definitionHash=sha256:8941a3cacee160456e2e22c818cfdc9a7ac4958b87234c8d2fb4060872a980a1",
      "specwright.eval-runner.input-hash.checkResultsHash=sha256:4f53cda18c2baa0c0354bb5f9a3ecbe5ed12ab4d8e11ba873c2f11161202b945"
    ]
  }
}
