{
  "evalId": "model_graded_denied_call",
  "targetRef": "artifact:plan",
  "status": "needs_review",
  "severity": "advisory",
  "findings": [
    {
      "code": "eval.grader.denied",
      "message": "Model-assisted grader call returned denied",
      "severity": "advisory",
      "targetRef": "artifact:plan",
      "metadata": {
        "modelAssisted": {
          "grader": "specwright.semantic-grader@1.0.0",
          "modelTool": "tool.model.semantic_grade",
          "rubricRef": "rubric:semantic-quality@1.0.0",
          "rubricHash": "sha256:aaaaaaaaaaaaaaaaaaaaaaaaaaaaaaaaaaaaaaaaaaaaaaaaaaaaaaaaaaaaaaaa",
          "modelCallId": "model-call:sha256:abad58a03a2db4efee8905af2d532865a7652df29b9886619faffda8e3628485",
          "outcome": "denied",
          "toolCallId": "toolcall_denied_call",
          "toolStatus": "denied",
          "toolSpan": {
            "toolId": "tool.model.semantic_grade",
            "toolVersion": "1.0.0",
            "argsHash": "sha256:0fdc4247d531f003101197d866432546b3aa310950f371207dfd0e445c38ce30",
            "cacheStatus": "bypass",
            "traceId": "trace_denied_call",
            "tokenBudget": 512
          },
          "requestedBy": {
            "phase": "quality_gate",
            "evalId": "model_graded_denied_call",
            "modelCallId": "model-call:sha256:abad58a03a2db4efee8905af2d532865a7652df29b9886619faffda8e3628485"
          },
          "idempotencyKey": "eval-grading:sha256:4714cabdd82e2ed28a687c114bbbc1b39d671dfed8efd30d1232efb3d59cf1ca",
          "outcomeLabel": "denied"
        }
      }
    }
  ],
  "evidenceRefs": [
    "evidence:brief"
  ],
  "producedBy": {
    "kind": "model_assisted",
    "ref": "specwright.semantic-grader@1.0.0"
  },
  "provenance": {
    "runId": "run_model_graded_fixture",
    "phase": "quality_gate",
    "decisionHash": "sha256:15423f36fd6116d25c20e4cdb3ed98108cef825f32c5ec16105d0dcb5617b298",
    "causationIds": [
      "specwright.eval-runner.input-hash.targetContentHash=sha256:3cf6f7be0d9849c42a8f6545577a3222d0a86defaaee20971ac305eb16f4d815",
      "specwright.eval-runner.input-hash.evidenceSnapshotHash=sha256:ba4a85a126eb516ad252a71d23e919c78411d0876739fedd5a7a47caa602e634",
      "specwright.eval-runner.input-hash.definitionHash=sha256:02693f9e6dd3e1cdce83af4153cdb43418d27a9da53b71be75f26695d70dfdff",
      "specwright.eval-runner.input-hash.checkResultsHash=sha256:a27cc96ff1cf31f80e65561a66191126152d65140541dd54b4eff1292471faec"
    ],
    "traceId": "trace_model_graded_fixture"
  }
}
