{
  "evalId": "artifact_completeness",
  "targetRef": "artifact:summary",
  "status": "fail",
  "severity": "blocking",
  "findings": [
    {
      "code": "artifact.sections.missing",
      "message": "Artifact is missing required sections: risks",
      "severity": "blocking",
      "targetRef": "artifact:summary",
      "repairHint": "Add the missing sections before this artifact can pass completeness.",
      "path": "$.sections"
    }
  ],
  "evidenceRefs": [],
  "producedBy": {
    "kind": "deterministic",
    "ref": "specwright.eval-runner.v1"
  },
  "provenance": {
    "decisionHash": "sha256:8464416df40e5f597750a6d09f789173743a7b479a8e48214e03705cc244bf7f",
    "causationIds": [
      "specwright.eval-runner.input-hash.targetContentHash=sha256:f58202ef75bcdbe1ec4ce2adba09ca2a92be19f587618106df662475d6bdb068",
      "specwright.eval-runner.input-hash.evidenceSnapshotHash=sha256:ba4a85a126eb516ad252a71d23e919c78411d0876739fedd5a7a47caa602e634",
      "specwright.eval-runner.input-hash.definitionHash=sha256:cf087f7c24a1795887b7d0e1fe78981dd28aa985aedb2090e72135800ddc8a0b",
      "specwright.eval-runner.input-hash.checkResultsHash=sha256:e578747b70a304140849582b11b9af66703a21a5791bb3a25df10d0635abba6c"
    ]
  }
}
