{
  "evalId": "artifact_schema_eval",
  "targetRef": "artifact:plan",
  "status": "pass",
  "severity": "blocking",
  "findings": [],
  "evidenceRefs": [
    "evidence:brief"
  ],
  "producedBy": {
    "kind": "deterministic",
    "ref": "specwright.eval-runner.v1"
  },
  "provenance": {
    "decisionHash": "sha256:e70a2cd322a2ea13818d158253bd151e75697ef055c26ebd2de946340981b6e0",
    "causationIds": [
      "specwright.eval-runner.input-hash.targetContentHash=sha256:badf79480aa0258f050e620f5562fa43455d17831927dfd7879799a22f84eb99",
      "specwright.eval-runner.input-hash.evidenceSnapshotHash=sha256:ba4a85a126eb516ad252a71d23e919c78411d0876739fedd5a7a47caa602e634",
      "specwright.eval-runner.input-hash.definitionHash=sha256:d0bcd6351e360c186ef13dedacba5eb0c4387081995e619d010bc16e9a13a8d5",
      "specwright.eval-runner.input-hash.checkResultsHash=sha256:e4263f214bcca6b8f19d4d880686f2dd51929d45893a0496d26d5ae9192dd663"
    ]
  }
}
