{
  "evalId": "target_missing",
  "targetRef": "artifact:plan",
  "status": "fail",
  "severity": "blocking",
  "findings": [
    {
      "code": "eval.target.missing",
      "message": "Eval target artifact is missing",
      "severity": "blocking",
      "repairHint": "Provide the target artifact declared by this eval definition."
    }
  ],
  "evidenceRefs": [],
  "producedBy": {
    "kind": "deterministic",
    "ref": "specwright.eval-runner.v1"
  },
  "provenance": {
    "decisionHash": "sha256:3bcae192fcc4be57b06f4c92b90f9792bcbdfb738174abaf9c3b5737c6f26932",
    "causationIds": [
      "specwright.eval-runner.input-hash.targetContentHash=sha256:995b2fe6c999b410784aa6cb8d76ecd0a469e66f4aea4d592f827208b4505e05",
      "specwright.eval-runner.input-hash.evidenceSnapshotHash=sha256:ba4a85a126eb516ad252a71d23e919c78411d0876739fedd5a7a47caa602e634",
      "specwright.eval-runner.input-hash.definitionHash=sha256:7734bf95c4081f3ff20672cf74bad553355e98b82425d8f8cc1b74e213c9baec",
      "specwright.eval-runner.input-hash.checkResultsHash=sha256:600033dc69e3f7bb31932d03908e07d237316b2d6baf2d53b706c61490e6a640"
    ]
  }
}
